{
  "$schema": "http://json-schema.org/draft-07/schema#",
  "title": "Music Library",
  "description": "A collection of music albums",
  "type": "array",
  "items": {
    "type": "object",
    "properties": {
      "title": {
        "type": "string",
        "description": "Album title"
      },
      "genres": {
        "type": "array",
        "items": { "type": "string" },
        "minItems": 1,
        "description": "List of genres"
      },
      "artists": {
        "type": "array",
        "items": { "type": "string" },
        "minItems": 1,
        "description": "List of artists"
      },
      "compositions": {
        "type": "array",
        "items": {
          "type": "object",
          "properties": {
            "name": { "type": "string" },
            "duration_seconds": { "type": "integer", "minimum": 1 }
          },
          "required": ["name", "duration_seconds"]
        },
        "minItems": 3,
        "description": "List of compositions"
      },
      "release_date": {
        "type": "string",
        "format": "date",
        "description": "Release date in YYYY-MM-DD format"
      },
      "age_restriction": {
        "type": "string",
        "enum": ["0+", "6+", "12+", "16+", "18+"],
        "description": "Age restriction"
      }
    },
    "required": [
      "title",
      "genres",
      "artists",
      "compositions",
      "release_date",
      "age_restriction"
    ]
  }
}